fatality,,"2023 1st Quarter Fatalities/Near FatalitiesJanuary 1 to March 31, 2023FatalitiesAdams"
fatality,Adams,"1.) A 9-month-old male child died on December 8, 2022, as a result of physicalabuse. Adams County Children, Youth and Families indicated the report onFebruary 10, 2023, naming the victim child’s mother and father as theperpetrators. On the date of the incident, it was reported the victim child wassleeping in the bed with the mother and the father and they awoke to find thechild underneath the father and unresponsive. Emergency medical serviceswere contacted, and the child was dead upon their arrival. It was determinedthrough the investigation that the mother and the father were under theinfluence of substances at the time of the incident and co-slept with the child.As the result of the safety assessment completed, the two other children in thehome at the time of the incident were placed in foster care and services wereprovided. At the time the report was indicated, the criminal investigation waspending. The family had no prior documented child welfare involvement.Chester"
fatality,Chester,"2.) A 4-year-old male child died on November 29, 2022, as a result of physicalabuse. Chester County Department of Human Services indicated the report onMarch 7, 2023, naming the victim child’s father as the perpetrator. On the dateof the incident, it was reported that the victim child was found unresponsive,and emergency medical services were contacted. The child was transported tothe hospital and was pronounced dead upon arrival. A toxicology screeningrevealed the child tested positive for an illegal substance. It was determinedthrough the investigation that the father was using the illegal substance at thetime of the incident. As the result of the safety assessment completed, the fourother children in the home at the time of the incident remained in the homewith the mother and services were provided. At the time the report wasindicated, the criminal investigation was pending. The family was previouslyknown to child welfare.Cumberland"
fatality,Cumberland,"3.) A 5-month-old female child died on August 16, 2016, as a result of physicalabuse. Cumberland County Children Youth and Youth Services (CCCYS)indicated the report on March 2, 2023, naming the victim child’s mother as theperpetrator and CCCYS founded the report on March 2, 2023, naming thefather as the perpetrator. On the date of the incident, the victim child wasfound blue and not breathing by the mother and the father and emergencymedical services (EMS) were contacted. Upon arrival of EMS, the child was deadand rigor mortis had set in. A preliminary autopsy revealed hemorrhaging in thethroat with white blood cells which indicated the child was alive when theinjury was sustained, clear liquid in the lungs, and bite marks on the face. Anautopsy revealed the cause of death was asphyxiation and the death wassuspected to be a homicide. It was determined through the investigation thatthe father had plead nolo contendere and the mother admitted to the causingthe injuries to the child. As the result of the safety assessment completed, theone other child in the home at the time of the incident was placed with arelative and no services were provided. At the time the report was indicated themother had been criminally charged and at the time the report was founded,1July 19, 20242023 1st Quarter Fatalities/Near FatalitiesJanuary 1 to March 31, 2023the father had a disposition of criminal charges. The family was previouslyknown to child welfare.Dauphin"
fatality,Dauphin,"4.) A 1-month-old male child died on December 19, 2022, as a result of physicalabuse. Dauphin County Social Services for Children and Youth indicated thereport on February 17, 2023, naming the victim child’s mother as theperpetrator. On the date of the incident, it was reported the mother co-sleptwith victim child and the child was found unresponsive with blood coming outof the mouth and nose. Emergency medical services were contacted, and thechild was transported to the hospital. The child subsequently was pronounceddead. It was determined through the investigation that the mother was underthe influence of an illegal substance and co-slept with the child. There were noother children in the home at the time of the incident and services wereprovided. At the time the report was indicated the mother had been criminallycharged. The family was previously known to child welfare.Lancaster"
fatality,Lancaster,"5.) A 12-year-old female child died on February 10, 2023, as a result of physicaland sexual abuse. Lancaster County Children and Youth Social Services Agencyindicated the report on March 30, 2023, naming the victim child’s mother’sparamour as the perpetrator. On the date of the incident, the victim child wasreported to be missing and that the mother’s paramour sexually assaulted thechild. Emergency services searched the home and found the child deceased inthe basement freezer. The death was ruled a homicide by strangulation. It wasdetermined through the investigation that the mother’s paramour confessed tokilling and raping the child. As the result of the safety assessment completed,the two other children in the home at the time of the incident remained in thehome and services were provided. At the time the report was indicated themother’s paramour had been criminally charged. The family had no priordocumented child welfare involvement.Lawrence"
fatality,Lawrence,"6.) A 23-month-old male child died on January 19, 2023, as a result of physicalabuse. Lawrence County Children and Youth Services indicated the report onMarch 17, 2023, naming the victim child’s mother’s paramour as theperpetrator. On the date of the incident, it was reported the victim child wasfound unresponsive and emergency medical services were contacted. The childwas transported to the local hospital and presented in cardiac arrest withswelling to the head with a brain bleed, blood in the chest, and blood in theabdomen. The child was subsequently pronounced dead. The injuries sustainedwere concerning for inflicted injury. An autopsy revealed the preliminary causeof death was blunt force trauma to the head. It was determined through theinvestigation that the mother’s paramour was the sole caregiver of the child atthe time of incident. As the result of the safety assessment completed the fourother children in the home at the time of the incident were placed in foster care.At the time the report was indicated, the criminal investigation was pending.The family had no prior documented child welfare involvement.Philadelphia2July 19, 20242023 1st Quarter Fatalities/Near FatalitiesJanuary 1 to March 31, 2023"
fatality,Philadelphia,"7.) A 2-year-old female child died on February 4, 2023, as a result of physicalabuse. Philadelphia Department of Human Services indicated the report onFebruary 26, 2023, naming the victim child’s legal guardian’s paramour as theperpetrator. On the date of the incident, it was reported the victim child wasfound unresponsive and emergency medical services were contacted. The childpresented to the hospital with extensive bruising covering the body. The injuriessustained were indicative of abuse and appeared to be from the child beingkicked or punched. The child subsequently died as a result of the injuriessustained. The autopsy revealed the child died as a result of blunt impactinjuries of the torso and the manner of death was homicide. It was determinedthrough the investigation, that the legal guardian’s paramour was the solecaregiver of the child when the injuries were sustained. There were no otherchildren in the home at the time of the incident and no services were provided.At the time the report was indicated, the legal guardian’s paramour had beencriminally charged. The family was previously known to child welfare.York"
fatality,York,"8.) An 8-month-old male child died on February 7, 2023, as a result of physicalabuse. York County Office of Children, Youth, and Families indicated the reporton March 6, 2023, naming the victim child’s father as the perpetrator. On thedate of the incident, it was reported the victim child had difficulty breathing andemergency medical services were contacted. The child was transported to thelocal hospital and presented in cardiac arrest with bruises on the face, head,chest, and back, and retinal hemorrhaging. The child subsequently died as aresult of the injuries sustained. An autopsy revealed the cause of death wasmultiple force trauma and ruled to be a homicide. It was determined throughthe investigation that the father was the sole caregiver of the child at the time ofincident and the father admitted to head butting, shaking, and tossing thechild. There were no other children in the home at the time of the incident andno services were provided. At the time the report was indicated the criminalinvestigation was pending. The family had no prior documented child welfareinvolvement.Near FatalitiesAllegheny"
near fatality,Allegheny,"1.) A 2-year-old female child nearly died on November 8, 2022, as a result ofphysical abuse. Allegheny County Office of Children, Youth, and Familiesindicated the report on January 9, 2023, naming an unknown perpetrator. Onthe date of the incident, the victim child presented to the local hospital due tovomiting and an altered mental status. The child sustained a subduralhematoma, retinal hemorrhages in both eyes, and healing right foot fractures.The injuries sustained were concerning for abuse. It was determined throughthe investigation that the child’s injuries were inflicted, and a perpetrator couldnot be determined. As the result of the safety assessment completed, the victimchild remained in the care of the father and no services were provided. Therewere no other children in the home at the time of the incident. At the time thereport was indicated, no criminal charges had been filed. The family had noprior documented child welfare involvement.3July 19, 20242023 1st Quarter Fatalities/Near FatalitiesJanuary 1 to March 31, 2023"
near fatality,Allegheny,"2.) A 9-year-old female child nearly died on November 27, 2022, as a result ofserious physical neglect. Allegheny County Office of Children, Youth, andFamilies indicated the report on January 23, 2023, naming the victim child’smother and father as the perpetrators. On the date of the incident, the victimchild was found unresponsive and emergency services were contacted. Thechild was transported to the hospital and administered Narcan. A toxicologyscreening revealed the child tested positive for illegal substances. It wasdetermined through the investigation that the mother and the father were thesole caregivers of the child at the time of the incident and the father had theillegal substances in his possession. As the result of the safety assessmentcompleted the victim child and the two other children in the home at the time ofthe incident remained in the mother’s care and services were provided. At thetime the report was indicated, the father had been criminally charged and nocriminal charges were filed against the mother. The family was previouslyknown to child welfare."
near fatality,Allegheny,"3.) A 2-year-old male child nearly died on December 14, 2022, as a result ofserious physical neglect. Allegheny County Office of Children, Youth, andFamilies indicated the report on January 12, 2023, naming the victim child’sfather and mother as the perpetrators. On the date of the incident, the victimchild was found unresponsive, and emergency medical services (EMS) werecontacted. Upon arrival of EMS, the child was determined to have ingestedillegal substances, and was administered Narcan. It was determined throughthe investigation that the father was the sole caregiver of the child at the timeof the incident and the mother was aware the father was selling illegalsubstances. As the result of the safety assessment completed, the victim childremained in the mother’s care and services were provided. There were no otherchildren in the home at the time of the incident. At the time the report wasindicated, the father had been criminally charged and no criminal chargeswere filed against the mother. The family was previously known to childwelfare.Beaver"
near fatality,Beaver,"4.) A 3-year-old female child nearly died on November 20, 2022, as a result ofserious physical neglect. Beaver County Children and Youth Services indicatedthe report on January 20, 2023, naming the victim child’s maternal aunt andmaternal grandmother as perpetrators. On the date of incident, it was reportedthe victim child ingested a prescribed substance, later was foundunresponsive, and emergency medical services were contacted. The child wasadministered Narcan and was transported to the hospital. A toxicologyscreening revealed the child tested positive for the prescribed substance. It wasdetermined through the investigation that the maternal aunt and maternalgrandmother failed to adequately secure the prescribed substance and delayedseeking medical care for the child after the child ingested the substance. As theresult of the safety assessment completed, the victim child was placed with themother and services were provided. At the time the report was indicated, thecriminal investigation was pending. The family was previously known childwelfare.Cambria4July 19, 20242023 1st Quarter Fatalities/Near FatalitiesJanuary 1 to March 31, 2023"
near fatality,Cambria,"5.) A 14-month-old male child nearly died on December 14, 2022, as a result ofserious physical neglect. Cambria County Children and Youth Servicesindicated the report on January 19, 2023, naming the victim child’s father asthe perpetrator. On the date of the incident, it was reported that victim childingested residue from a prescribed substance in the home. Emergency medicalservices were contacted, and the child was transported to the hospital. Thechild was administered Narcan and responded positively. It was determinedthrough the investigation that the substance ingested by the child was anillegal substance and the father was the sole caregiver of the child at the timeof the incident. As the result of the safety assessment completed, the victimchild and the one other child in the home at the time of the incident wereplaced with a relative and services were provided. At the time the report wasindicated, the father had been criminally charged. The family was previouslyknown to child welfare.Clearfield"
near fatality,Clearfield,"6.) A 14-month-old male child nearly died on February 11, 2023, as a result ofphysical abuse. Clearfield County Children and Youth Services indicated thereport on March 30, 2023, naming the victim child’s mother’s paramour as theperpetrator. On the date of the incident, it was reported the victim child wasfound face down in the bathtub by the paramour and emergency medicalservices were contacted. The child presented to the hospital with bruising onthe forehead, chin, and legs, a swollen upper lip, blood around the lips andmouth, abrasions on the back of the head, a depressed skull fracture, variousfractures on the body, subdural hematomas, retinal hemorrhages, and a spinalligamentous injury. The bruises were in various stages of healing. The injuriessustained were indicative of abuse. It was determined through the investigationthat the mother’s paramour admitted to causing the injuries sustained by thechild. As the result of the safety assessment completed, the victim child and theone other child in the home at the time of the incident were placed in foster andkinship care and services were provided. At the time the report was indicated,the mother’s paramour had been criminally charged. The family had no priordocumented child welfare involvement.Clinton"
near fatality,Clinton,"7.) A 3-year-old female child nearly died on November 20, 2022, as a result ofserious physical neglect and physical abuse. Clinton County Children andYouth Agency indicated the report on January 19, 2023, naming the victimchild’s mother as the perpetrator. On the date of the incident, the victim childwas transported to an urgent care by the mother due to being lethargic anddifficult to arouse; the child subsequently was sent to the hospital. Uponarrival at the hospital, the child tested positive for an illegal substance. It wasdetermined through the investigation, that the mother admitted the childingested the illegal substance and immediate medical care was not sought. Asthe result of the safety assessment completed, the victim child was placed withrelatives and services were provided. There were no other children in the homeat the time of the incident. At the time of the report was indicated, the criminalinvestigation was pending. The family was previously known to child welfare.Cumberland5July 19, 20242023 1st Quarter Fatalities/Near FatalitiesJanuary 1 to March 31, 2023"
near fatality,Cumberland,"8.) A 2-month-old male child nearly died on September 12, 2022, as a result ofphysical abuse. Cumberland County Children and Youth indicated the reporton January 25, 2022, naming the victim child’s father as the perpetrator. Onthe date of the incident, it was reported the victim child was found pale andgasping for air, with blood coming out of the nose and emergency medicalservices were contacted. The child presented to the hospital with anintracranial injury and a subdural hematoma. The injuries sustained wereindicative of abuse. It was determined through the investigation that the fatheradmitted to causing the injuries sustained by the child. As the result of thesafety assessment completed, the victim child and the two other children in thehome at the time of the incident were placed with a relative and services wereprovided. At the time the report was indicated the father had been criminallycharged. The family had no prior documented child welfare involvement."
near fatality,Cumberland,"9.) A 9-month-old female child nearly died on November 27, 2022, as a result ofphysical abuse. Cumberland County Children and Youth Services indicatedthe report on January 19, 2023, naming the victim child’s mother as theperpetrator. On the date of the incident, it was reported the victim child wasleft unattended in the bathtub and the child was subsequently foundunresponsive. Emergency medical services were contacted, and the child wastransported to an acute medical center. It was determined through theinvestigation that the mother left the child in bathtub unsupervised which ledto the likelihood of child sustaining serious injury or death. As the result of thesafety assessment completed, the victim child and the one other child in thehome at the time of the incident remained in the care of the mother andservices were provided. At the time the report was indicated, the mother hadbeen criminally charged. The family was previously known to child welfare.Dauphin"
near fatality,Dauphin,"10.) A 15-year-old male child nearly died on December 29, 2022, as a result ofphysical abuse. Dauphin County Children and Youth Agency indicated thereport on February 26, 2023, naming the victim child’s brother as theperpetrator. On the date of the incident, the victim child was foundunconscious, and emergency medical services were contacted. The child presented to the hospital with a blood alcohol level of .306. It was determinedthrough the investigation that the child was drinking alcohol with the adultbrother. As the result of the safety assessment completed, the victim child wasplaced in foster care and the one other child in the home at the time of theincident remained in the home. The family received services. At the time thereport was indicated, the criminal investigation was pending. The family hadno prior documented child welfare involvement.Erie"
near fatality,,
near fatality,Erie,"11.) A 12-month-old male child nearly died on November 27, 2022, as a result ofphysical abuse and serious physical neglect. Erie County Office of Childrenand Youth indicated the report on January 9, 2023, naming the victim child’smother as the perpetrator. On the date of the incident, it was reported thevictim child was in the bathtub and began wheezing and choking andemergency medical services were contacted. Upon arrival at the hospital, atoxicology screening revealed the child tested positive for illegal substances. Itwas determined through the investigation that the mother was the sole6July 19, 20242023 1st Quarter Fatalities/Near FatalitiesJanuary 1 to March 31, 2023caregiver of the child at the time of the incident and provided inconsistentaccounts of the incident. As the result of the safety assessment completed, thevictim child was placed in foster care and services were provided. There wereno other children in the home at the time of the incident. At the time the reportwas indicated, the criminal investigation was pending. The family waspreviously known to child welfare."
near fatality,Erie,"12.) A 4-month-old male child nearly died on December 26, 2022, as a result ofphysical abuse. Erie County Office of Children and Youth founded the reporton February 21, 2023, naming the victim child’s father as the perpetrator. Onthe date of the incident, the victim child was transported to the hospital due tothe child being fussy and lethargic. The child presented to the hospital with asubdural hematoma and a healing buckle facture on the left tibia. It wasdetermined through the investigation that the father had been the solecaregiver of the child at the time of the incident. As the result of the safetyassessment completed, the victim child and the four other children in thehome at the time of the incident were placed in kinship care. At the time thereport was founded, the father had a disposition of criminal charges. Thefamily was previously known to child welfare.Lackawanna"
near fatality,Lackawanna,"13.) A 1-week-old male child nearly died on September 1, 2022, as a result ofserious physical neglect. Lackawanna County Office of Youth and FamilyServices indicated the report on March 7, 2023, naming the victim child’smother and father as the perpetrators. On January 10, 2023, the victim childwas transported to the hospital by the mother and the father due to concernsof a possible hernia. Upon arrival at the hospital, the child was determined tobe malnourished. It was determined through the investigation, that the motherand the father failed to provide the child with adequate nutrition dating backto September 1, 2022, which lead to malnourishment and failure to thrive. Asthe result of the safety assessment completed, the victim child was placed inkinship care and the one other child in the home at the time of the incidentwas placed with their respective father. At the time the report was indicated,the mother and the father had been criminally charged. The family had noprior documented child welfare involvement.Lehigh"
near fatality,Lehigh,"14.) A 3-month-old male child nearly died on November 21, 2022, as a result ofphysical abuse. Lehigh County Office of Children and Youth Services indicatedthe report on January 18, 2023, naming the victim child’s mother as theperpetrator. On the date of the incident, it was reported the victim child arrivedat daycare bruised and vomiting and the child was transported to the hospital.The child presented to the hospital with hemorrhaging of the head and eyesand fractures to the tibia and femur. The injuries sustained were indicative ofthe child being violently shaken. It was determined through the investigationthat the mother did not provide a plausible explanation for the injuriessustained by the child. As the result of the safety assessment completed, thevictim child was placed in foster care and services were provided. There wereno other children in the home at the time of the incident. At the time the reportwas indicated, the criminal investigation was pending. The family was7July 19, 20242023 1st Quarter Fatalities/Near FatalitiesJanuary 1 to March 31, 2023previously known to child welfare."
near fatality,Lehigh,"15.) An 8-month-old male child nearly died on November 15, 2022, as a result ofserious physical neglect. Lehigh County Office of Children and Youth Servicesindicated the report on January 6, 2023, naming the victim child’s father asthe perpetrator. On the date of the incident, the victim child was transported tothe emergency room due to respiratory distress. Upon arrival at the hospital,the child was administered Narcan and responded positively. A toxicologyscreening revealed the child tested positive for illegal substances. It wasdetermined through the investigation that the father was the sole caregiver ofthe child at the time of the incident. As the result of the safety assessmentcompleted, the victim child and the two other children in the home at the timeof the incident were placed in the care of relatives and their respective fatherand services were provided. At the time the report was indicated, the fatherhad been criminally charged. The family was previously known to child welfare.The victim child was previously the subject of a near fatality investigation.Luzerne"
