near fatality,Northampton,"6. A three month old female child nearly died on May 5, 2013 due to injuries received from physical abuse.  Northampton County Children and Youth Services substantiated the father as the perpetrator in July 2013.  On the date of incident, the mother took the child to the hospital due to bruising on the earlobe, left eye, and cheekbone.  The child was admitted to the hospital and an examination revealed chronic and acute intracranial hemorrhaging and bilateral retinal hemorrhaging.   The father was the only caretaker present when the child was injured, and the mother stated that the child was fine when the mother left the house on the date of incident.  The father stated that earlier in the day while driving, he swerved the car to avoid hitting something and heard a thud. He assumed that the child had hit her head on the car seat but did not check.  The father also stated that when they got home, the child accidentally hit her head on the door frame when the father was carrying her inside.  The doctor stated that the father’s explanation of what happened would not have caused this much damage, as the injuries sustained could only have been caused by blunt force trauma.  The doctors also stated that the age of the child’s bruises indicated that she was not immediately brought to the hospital. A safety plan was developed with the mother and father not being permitted to be unsupervised with the victim child or her five-year old sister.  The sister was taken to the maternal grandmother’s home on the evening of the date of incident.  The victim child was released from the hospital three days after the date of incident into the maternal grandmother’s care.  At the time of the child’s discharge, hospital staff stated that it would take months to reduce the bleeding behind the child’s eye.  The mother then moved into the maternal grandmother’s home and participated in parenting classes.  The Visiting Nurses Program went to the house and worked with the mother showing her how to care for the child’s injuries.  The father is now residing with a family member.  On May 30, 2013, the father admitted in a written statement that he shook the child until she was barely responsive and then placed her in the bed until the child’s mother came home.  The family was not known to Children and Youth Services prior to this incident.  The police conducted an investigation in Aug. 2013.  The father was charged with aggravated assault, simple assault, recklessly endangering another person, and two counts of endangering the welfare of children.  The father pled guilty in Jan. 2014,    to simple assault, recklessly endangering another person and one count of endangering the welfare of children.  He is scheduled for sentencing in March 2014."
near fatality,Philadelphia,"7. A 6 year old male child nearly died on April 7, 2013 as a result of medical neglect.Philadelphia Department of Human Services substantiated the case in May 2013,naming the mother as the perpetrator. The victim child’s condition started when he wasin the care of his father in the afternoon on the date of incident. The child had a coldthat weekend. The mother sent the child to the father’s home with cold medicine and aninhaler, which he normally uses for ongoing asthma symptoms. The child also hasknown allergies to peanuts and carrots. Around 2:00 pm on the date of incident, thefather noticed that the child was having difficulty breathing. The child was given acouple puffs from the inhaler and then took his cold medicine. The child threw up about20 minutes later. The father initially decided to take the child to the Emergency Room,but then decided against it because he did not have the child’s medical insuranceinformation. Instead, the father called the maternal grandmother to get the medicalinsurance information. The maternal grandmother told the father to bring the childhome (as the mother lives in the maternal grandmother’s home) and they would takethe child to the hospital. The father brought the child to the mother’s home around 4:00pm on the date of incident. The stepfather was at the mother’s home to receive thechild. The father and the mother do not interact directly due to fighting with each other.The father reports that the child appeared to be doing better and was asleep when they2013 2nd Quarter FatalitiesApril 1 – June 30 2013 11arrived at the mother’s home. The mother and child arrived at the hospital atapproximately 6:45 pm.The hospital determined that the child suffered a severe allergic reaction, includingswelling and difficulty breathing. Medical professionals involved in this case reportedthat the allergic reaction could have been fatal due to the mother’s delay in seekingmedical treatment for the child. The mother failed to act in a timely manner in gettingthe child medical care which resulted in the child suffering severe respiratory distressthat almost killed him. The investigation determined that instead of taking the child tothe hospital right away, the mother videotaped the child answering questions that shewas asking about the child’s condition. The mother also did not provide the father thechild’s medical insurance information or fill a prescription for a new nebulizer to replacethe broken one the child had been using. The mother chose to take the child to ahospital a distance from home rather than calling an ambulance to come get child.When asked about this decision, the mother stated that she felt that she could get childto the hospital faster than an ambulance. The maternal grandmother will ensure thatthe mother keeps all future medical appointments and gives the child all prescribedmedicines. A relative who lives in the father’s home will ensure that the father is alsoproviding proper medical care for the child. There are no other children in the home.The family was not known to Philadelphia Department of Human Services division ofChildren and Youth Services prior to this report."
near fatality,Philadelphia,"8. A one year old female child nearly died on April 10, 2013 due to physical abuse andmedical neglect. Philadelphia Department of Human Services substantiated the reportin May 2013, naming the mother as a perpetrator for medical neglect, the mother’sparamour as a perpetrator for physical abuse, and the child’s babysitter as a perpetratorfor physical abuse. Prior to the date of incident, the mother’s paramour and a babysitterwere caring for the child over a period of several days while the mother was notavailable. The child was observed “not acting as herself” and seemed “unwell.” Whenthe mother came back, she was advised by other family members to take the child tothe doctor. The mother failed to seek medical treatment for the child for approximatelyone week. On the date of incident, the mother’s paramour found the child on the floorwith her eyes rolling back into her head. He threw water on her and attempted CPR.The maternal great uncle and maternal grandmother then took the child to the hospital.The child was cold and unresponsive upon arrival to the hospital and had to beintubated. The child was diagnosed with a collapsed lung, three fractured ribs, a severeliver laceration, and a small right kidney laceration, as well as bruising to the back,lumbar area, and both thighs.2013 2nd Quarter FatalitiesApril 1 – June 30 2013 12It is still undetermined how the child’s injuries occurred. None of the perpetrators bycommission have admitted to causing the child’s injuries. The child and his sibling arenow residing with their biological father and he is filing for full custody. The mother hassupervised visits with the children. The father and children are receiving In-HomeProtective Services to monitor and assist in the child’s recovery, provide trauma-focused therapy for both children, assist with the father’s parenting skills, and help thefather find and maintain employment. The father’s family is providing support for himand the children during this time. The family was not known to Philadelphia Departmentof Human Services before this incident. The criminal investigation is ongoing at thetime of this writing."
near fatality,Philadelphia,"9. An eight month old male child nearly died on April 12, 2013 due to injuries receivedfrom physical abuse. In July 2013, the Philadelphia Department of Human Services,substantiated the report and named the parents as perpetrators. The child was taken tothe hospital on the date of incident due to a stab wound to the back of the child’s head.The parents both stated that the child was trying to pull himself up onto a bed framewhen he slipped and fell backwards onto a knife, which penetrated his skull and wentinto his brain and brain stem. The child eventually stopped breathing on his own, wasput on life support, and was listed in critical condition. The child is expected to survive,but will be in a vegetative state for the rest of his life. Both parents stated that one ofthe siblings (ages four and two) must have brought a Swiss Army knife into the housewithout their knowing. The child’s neurosurgeon stated that the knife that caused thechild’s injury had a four to five-inch long blade, with a width of about half an inch. Theneurosurgeon stated that the incident could not have occurred by falling onto the knifeas the parent’s state, it could only have penetrated that deep if it was inflicted. Thefather eventually admitted to stabbing the child in the back of the head during a violentargument with the mother. The father is currently incarcerated and the mother’s case ispending with law enforcement.A safety plan for the second child was completed immediately which stated that neitherparent could have unsupervised visits with the child, and that the child will reside withthe maternal aunt. The family is known to the Philadelphia Department of Human Services from two reports received in 2011. The first report alleged that the only persongoing in and out of the house was an eighteen-year old sibling with no parentalsupervision. It was discovered that this person was actually the child’s father and thecase was closed. A second report was received in 2011 when the youngest siblingreceived a skull fracture after a fifteen-year old aunt picked the child up in a car seatwithout realizing he was not properly secured. The child fell from the car seat onto the2013 2nd Quarter FatalitiesApril 1 – June 30 2013 13pavement and fractured his skull. The investigation concluded that the explanation wasconsistent with the injury, and the report was unfounded."
near fatality,Philadelphia,"10. A one year old male child nearly died on June 16, 2013. The PhiladelphiaDepartment of Human Services (DHS) investigated the case and substantiated themother’s paramour as the perpetrator by commission, as well as the mother as aperpetrator by omission for failing to protect child. The mother took the child to thehospital on the date of incident because the child was having difficulty breathing;however, the mother waited approximately ten hours to take the child to the EmergencyRoom. Upon examination, the hospital found bruising to the child’s chest. X-raysrevealed multiple rib fractures and pulmonary contusions. The child also received aCAT scan, which showed that the child had a lacerated liver. The mother did not havean explanation for the child’s injuries. The mother initially stated that she was the onlyone who cares for the child, but later recanted and admitted to police that she left thechild in her paramour’s care while she was working from 8:00 am to 6:00 pm the dayprior to the incident. The mother’s paramour has not admitted to causing the child’sinjuries. No criminal charges have been filed at this time. There are no other children inthe home. There is no history of involvement with DHS."
near fatality,Philadelphia,"11.  A four month old female child nearly died on June 17, 2013 due to failure to thrive.   Philadelphia Department of Human Services (DHS) substantiated the report in July 2013, naming both the mother and the father as perpetrators of neglect.  On the date of incident, the child was admitted to the hospital due to seizures.  The seizures were a result of “water intoxication” from the improper mixture of her formula by her parents.  Neither parent was able to describe appropriate formula preparation to hospital staff.  The child’s sodium levels were dangerously low and her weight was in the zero percentile at the time of admission.  A home assessment was completed two days after the date of the incident, and DHS found the home to be in “deplorable condition.”   The child has a two-year old sister, who was placed in an emergency shelter by DHS after the date of incident.  DHS first became involved with this family when the mother tested positive for marijuana use when giving birth to the sibling in December 2010.  The home was assessed and was determined to be safe and adequately prepared for the arrival of the infant.  The family was offered Child Abuse Prevention and Treatment Services (for maternal substance abuse issues) but the mother declined.  The final assessment determined that the infant was safe in the home and the case was closed in mid-December 2010.  A second GPS report was received in January 2013 when the mother tested positive for marijuana at the time of the victim child’s birth.  The mother admitted that two weeks prior to giving birth to the victim child, the mother ingested cupcakes and brownies made with marijuana at her birthday party.  The report was investigated and findings were present; however, the mother ingested the marijuana-laced food at someone else’s home.  The family home was assessed and no safety threats were identified.  The case was closed in February 2013. There are no criminal charges at this time."
